{
  "containment_graph": {
    "edges": [
      {
        "at_state": "invoke-concord-change-observe",
        "child_loop_id": "observe",
        "deadline_outcome": "escalated",
        "failure_state": "escalated",
        "grant": {
          "budgets": {
            "max_attempts": 3,
            "max_cost_units": 10,
            "max_elapsed_seconds": 3600,
            "on_exhaustion": "failed"
          },
          "capabilities": [
            "accept-parent",
            "escalate",
            "execute-work",
            "produce-evidence"
          ],
          "scope": {
            "external_mutations": [],
            "network": "none",
            "read_paths": [
              "."
            ],
            "write_paths": []
          }
        },
        "id": "concord-change-observe",
        "input_mapping": {},
        "output_mapping": {},
        "parent_loop_id": "concord-change",
        "success_state": "invoke-concord-change-negotiate",
        "timeout_seconds": 3600
      },
      {
        "at_state": "invoke-concord-change-negotiate",
        "child_loop_id": "negotiate",
        "deadline_outcome": "escalated",
        "failure_state": "escalated",
        "grant": {
          "budgets": {
            "max_attempts": 3,
            "max_cost_units": 10,
            "max_elapsed_seconds": 3600,
            "on_exhaustion": "failed"
          },
          "capabilities": [
            "accept-parent",
            "escalate",
            "execute-work",
            "produce-evidence"
          ],
          "scope": {
            "external_mutations": [],
            "network": "none",
            "read_paths": [
              "."
            ],
            "write_paths": []
          }
        },
        "id": "concord-change-negotiate",
        "input_mapping": {},
        "output_mapping": {},
        "parent_loop_id": "concord-change",
        "success_state": "invoke-concord-change-bind",
        "timeout_seconds": 3600
      },
      {
        "at_state": "invoke-concord-change-bind",
        "child_loop_id": "bind",
        "deadline_outcome": "escalated",
        "failure_state": "escalated",
        "grant": {
          "budgets": {
            "max_attempts": 3,
            "max_cost_units": 10,
            "max_elapsed_seconds": 3600,
            "on_exhaustion": "failed"
          },
          "capabilities": [
            "accept-parent",
            "escalate",
            "execute-work",
            "produce-evidence"
          ],
          "scope": {
            "external_mutations": [],
            "network": "none",
            "read_paths": [
              "."
            ],
            "write_paths": []
          }
        },
        "id": "concord-change-bind",
        "input_mapping": {},
        "output_mapping": {},
        "parent_loop_id": "concord-change",
        "success_state": "invoke-concord-change-execute",
        "timeout_seconds": 3600
      },
      {
        "at_state": "invoke-concord-change-execute",
        "child_loop_id": "execute",
        "deadline_outcome": "escalated",
        "failure_state": "escalated",
        "grant": {
          "budgets": {
            "max_attempts": 3,
            "max_cost_units": 10,
            "max_elapsed_seconds": 3600,
            "on_exhaustion": "failed"
          },
          "capabilities": [
            "accept-parent",
            "escalate",
            "execute-work",
            "produce-evidence"
          ],
          "scope": {
            "external_mutations": [],
            "network": "none",
            "read_paths": [
              "."
            ],
            "write_paths": [
              ".github",
              "README.md",
              "README.ru.md",
              "docs",
              "framework",
              "plugins",
              "schemas",
              "site",
              "src",
              "tests",
              "tools"
            ]
          }
        },
        "id": "concord-change-execute",
        "input_mapping": {},
        "output_mapping": {},
        "parent_loop_id": "concord-change",
        "success_state": "invoke-concord-change-verify",
        "timeout_seconds": 3600
      },
      {
        "at_state": "invoke-concord-change-verify",
        "child_loop_id": "verify",
        "deadline_outcome": "escalated",
        "failure_state": "escalated",
        "grant": {
          "budgets": {
            "max_attempts": 3,
            "max_cost_units": 10,
            "max_elapsed_seconds": 3600,
            "on_exhaustion": "failed"
          },
          "capabilities": [
            "accept-parent",
            "escalate",
            "execute-work",
            "produce-evidence",
            "review-candidate"
          ],
          "scope": {
            "external_mutations": [],
            "network": "none",
            "read_paths": [
              "."
            ],
            "write_paths": []
          }
        },
        "id": "concord-change-verify",
        "input_mapping": {},
        "output_mapping": {},
        "parent_loop_id": "concord-change",
        "success_state": "invoke-concord-change-publish",
        "timeout_seconds": 3600
      },
      {
        "at_state": "invoke-concord-change-publish",
        "child_loop_id": "publish",
        "deadline_outcome": "escalated",
        "failure_state": "escalated",
        "grant": {
          "budgets": {
            "max_attempts": 3,
            "max_cost_units": 10,
            "max_elapsed_seconds": 3600,
            "on_exhaustion": "failed"
          },
          "capabilities": [
            "accept-parent",
            "escalate",
            "execute-work",
            "produce-evidence"
          ],
          "scope": {
            "external_mutations": [
              "github-pages",
              "github-repository-social-preview"
            ],
            "network": "write",
            "read_paths": [
              "."
            ],
            "write_paths": []
          }
        },
        "id": "concord-change-publish",
        "input_mapping": {},
        "output_mapping": {},
        "parent_loop_id": "concord-change",
        "success_state": "invoke-concord-change-evolve",
        "timeout_seconds": 3600
      },
      {
        "at_state": "invoke-concord-change-evolve",
        "child_loop_id": "evolve",
        "deadline_outcome": "escalated",
        "failure_state": "escalated",
        "grant": {
          "budgets": {
            "max_attempts": 3,
            "max_cost_units": 10,
            "max_elapsed_seconds": 3600,
            "on_exhaustion": "failed"
          },
          "capabilities": [
            "accept-parent",
            "escalate",
            "execute-work",
            "produce-evidence"
          ],
          "scope": {
            "external_mutations": [],
            "network": "none",
            "read_paths": [
              "."
            ],
            "write_paths": []
          }
        },
        "id": "concord-change-evolve",
        "input_mapping": {},
        "output_mapping": {},
        "parent_loop_id": "concord-change",
        "success_state": "work",
        "timeout_seconds": 3600
      }
    ],
    "roots": [
      "concord-change"
    ]
  },
  "evidence_contracts": [
    {
      "accepted_results": [
        "pass"
      ],
      "candidate_binding_required": true,
      "description": "Evidence that bind reached its accepted outcome.",
      "id": "bind-acceptance",
      "policy_binding_required": true,
      "producer_capability": "produce-evidence",
      "required_claims": [
        "bind-outcome"
      ]
    },
    {
      "accepted_results": [
        "pass"
      ],
      "candidate_binding_required": true,
      "description": "Evidence that concord-change reached its accepted outcome.",
      "id": "concord-change-acceptance",
      "policy_binding_required": true,
      "producer_capability": "produce-evidence",
      "required_claims": [
        "concord-change-outcome"
      ]
    },
    {
      "accepted_results": [
        "pass"
      ],
      "candidate_binding_required": true,
      "description": "Evidence that evolve reached its accepted outcome.",
      "id": "evolve-acceptance",
      "policy_binding_required": true,
      "producer_capability": "produce-evidence",
      "required_claims": [
        "evolve-outcome"
      ]
    },
    {
      "accepted_results": [
        "pass"
      ],
      "candidate_binding_required": true,
      "description": "Evidence that execute reached its accepted outcome.",
      "id": "execute-acceptance",
      "policy_binding_required": true,
      "producer_capability": "produce-evidence",
      "required_claims": [
        "execute-outcome"
      ]
    },
    {
      "accepted_results": [
        "pass"
      ],
      "candidate_binding_required": true,
      "description": "Evidence that negotiate reached its accepted outcome.",
      "id": "negotiate-acceptance",
      "policy_binding_required": true,
      "producer_capability": "produce-evidence",
      "required_claims": [
        "negotiate-outcome"
      ]
    },
    {
      "accepted_results": [
        "pass"
      ],
      "candidate_binding_required": true,
      "description": "Evidence that observe reached its accepted outcome.",
      "id": "observe-acceptance",
      "policy_binding_required": true,
      "producer_capability": "produce-evidence",
      "required_claims": [
        "observe-outcome"
      ]
    },
    {
      "accepted_results": [
        "pass"
      ],
      "candidate_binding_required": true,
      "description": "Evidence that publish reached its accepted outcome.",
      "id": "publish-acceptance",
      "policy_binding_required": true,
      "producer_capability": "produce-evidence",
      "required_claims": [
        "publish-outcome"
      ]
    },
    {
      "accepted_results": [
        "pass"
      ],
      "candidate_binding_required": true,